{
  "Tool Call": {
    "test_data": [
      "Hemoglobin",
      "White Blood Cell Count",
      "Glucose",
      "Cholesterol Total",
      "Creatinine"
    ],
    "test_values": [
      "12.5 g/dL",
      "7,200/μL",
      "95 mg/dL",
      "220 mg/dL",
      "1.1 mg/dL"
    ],
    "reference_ranges": [
      "12.0-15.5 g/dL",
      "4,500-11,000/μL",
      "70-100 mg/dL",
      "<200 mg/dL",
      "0.6-1.3 mg/dL"
    ],
    "patient_name": "Sarah Johnson",
    "patient_id": "PT-2024-001547",
    "collection_date": "2024-01-15T08:30:00Z",
    "report_format": "CLINICAL",
    "include_interpretations": true
  },
  "Return Data": {
    "formatted_report": "LABORATORY REPORT\n\nPatient: Sarah Johnson\nPatient ID: PT-2024-001547\nCollection Date: 2024-01-15T08:30:00Z\nLab: Clinical Laboratory\nPhysician: Not Specified\n\nTEST RESULTS:\nHemoglobin: 12.5 g/dL (Reference: 12.0-15.5 g/dL) - NORMAL\nWhite Blood Cell Count: 7,200/μL (Reference: 4,500-11,000/μL) - NORMAL\nGlucose: 95 mg/dL (Reference: 70-100 mg/dL) - NORMAL\nCholesterol Total: 220 mg/dL (Reference: <200 mg/dL) - HIGH\nCreatinine: 1.1 mg/dL (Reference: 0.6-1.3 mg/dL) - NORMAL\n\nCLINICAL INTERPRETATIONS:\nElevated total cholesterol may indicate increased cardiovascular risk. Recommend lifestyle modifications and follow-up testing.",
    "report_sections": [
      "Header Information",
      "Test Results",
      "Clinical Interpretations",
      "Laboratory Certification"
    ],
    "abnormal_flags": [
      "Cholesterol Total"
    ],
    "report_summary": "Laboratory report for Sarah Johnson showing 5 tests performed. 4 results within normal limits, 1 elevated value (Total Cholesterol). Clinical follow-up recommended for lipid management."
  }
}